<?xml version="1.0" encoding="UTF-8"?>
<!DOCTYPE world SYSTEM "world.dtd">
<world>
 <level name="Get">
  <linked-edges>
   <edge-set id="es1">
    <edgeref id="e71"/>
   </edge-set>
   <edge-set id="es2">
    <stamp id="es1" active="true"/>
    <edgeref id="e72"/>
   </edge-set>
   <edge-set id="es3">
    <edgeref id="e73"/>
   </edge-set>
   <edge-set id="es4">
    <stamp id="es1" active="false"/>
	<stamp id="es2" active="false"/>
	<stamp id="es5" active="true"/>
    <edgeref id="e74"/>
   </edge-set>
   <edge-set id="es5">
    <edgeref id="e75"/>
   </edge-set>
  </linked-edges>
  <boards>
   <board name="Get.Example">
    <node kind="INCOMING" id="n70">
     <input/>
     <output>
      <port num="0" edge="e71"/>
      <port num="1" edge="e72"/>
      <port num="2" edge="e73"/>
	  <port num="3" edge="e74"/>
     </output>
     <layout>
      <x>1.0</x>
      <y>0.00000</y>
     </layout>
    </node>
    <node kind="OUTGOING" id="n71">
     <input>
      <port num="0" edge="e75"/>
     </input>
     <output/>
     <layout>
      <x>3.0</x>
      <y>7.68000</y>
     </layout>
    </node>
    <node kind="GET" id="n72">
     <input>
      <port num="0" edge="e71"/>
	  <port num="1" edge="e72"/>
	  <port num="2" edge="e73"/>
	  <port num="3" edge="e74"/>
     </input>
     <output>
      <port num="0" edge="e75"/>
     </output>
     <layout>
      <x>1.0</x>
      <y>2.5</y>
     </layout>
    </node>
    <edge description="chute1" variableID="-1" pinch="true" width="wide" editable="true" id="e71" buzzsaw="false">
     <from>
      <noderef id="n70" port="0"/>
     </from>
     <to>
      <noderef id="n72" port="0"/>
     </to>
     <edge-layout>
      <point>
       <x>1.5</x>
       <y>0.0</y>
      </point>
      <point>
       <x>1.5</x>
       <y>0.0</y>
      </point>
      <point>
       <x>1.5</x>
       <y>2.5</y>
      </point>
      <point>
       <x>1.5</x>
       <y>2.5</y>
      </point>
     </edge-layout>
    </edge>
    <edge description="chute2" variableID="-1" pinch="false" width="narrow" editable="true" id="e72" buzzsaw="false">
     <from>
      <noderef id="n70" port="1"/>
     </from>
     <to>
      <noderef id="n72" port="1"/>
     </to>
     <edge-layout>
      <point>
       <x>2.5</x>
       <y>0.0</y>
      </point>
      <point>
       <x>2.5</x>
       <y>0.0</y>
      </point>
      <point>
       <x>2.5</x>
       <y>2.5</y>
      </point>
      <point>
       <x>2.5</x>
       <y>2.5</y>
      </point>
     </edge-layout>
    </edge>
	<edge description="chute3" variableID="-1" pinch="false" width="narrow" editable="true" id="e73" buzzsaw="false">
     <from>
      <noderef id="n70" port="2"/>
     </from>
     <to>
      <noderef id="n72" port="2"/>
     </to>
     <edge-layout>
      <point>
       <x>3.5</x>
       <y>0.0</y>
      </point>
      <point>
       <x>3.5</x>
       <y>0.0</y>
      </point>
      <point>
       <x>3.5</x>
       <y>2.5</y>
      </point>
      <point>
       <x>3.5</x>
       <y>2.5</y>
      </point>
     </edge-layout>
    </edge>
	<edge description="chute4" variableID="-1" pinch="false" width="narrow" editable="true" id="e74" buzzsaw="false">
     <from>
      <noderef id="n70" port="3"/>
     </from>
     <to>
      <noderef id="n72" port="3"/>
     </to>
     <edge-layout>
      <point>
       <x>4.5</x>
       <y>0.0</y>
      </point>
      <point>
       <x>4.5</x>
       <y>0.0</y>
      </point>
      <point>
       <x>4.5</x>
       <y>2.5</y>
      </point>
      <point>
       <x>4.5</x>
       <y>2.5</y>
      </point>
     </edge-layout>
    </edge>
	<edge description="chute5" variableID="-1" pinch="false" width="wide" editable="true" id="e75" buzzsaw="false">
     <from>
      <noderef id="n72" port="0"/>
     </from>
     <to>
      <noderef id="n71" port="0"/>
     </to>
     <edge-layout>
      <point>
       <x>3.5</x>
       <y>3.96</y>
      </point>
      <point>
       <x>3.5</x>
       <y>3.96</y>
      </point>
      <point>
       <x>3.5</x>
       <y>7.68</y>
      </point>
      <point>
       <x>3.5</x>
       <y>7.68</y>
      </point>
     </edge-layout>
    </edge>
   </board>
  </boards>
 </level>
</world>
